"doi","title","amazon_id","review_text"
"10.1086/656863","Biological Systematics: Principles and Applications","0801447992","At last we have the first condense and well written treatment on Cladistics for English speakers. Phylogenetic systematics or Cladistics is a young field relative to the more than 200 years of taxonomic history. The  pioneers textbooks on the subject (e.g., Nelson and Platnick, Wiley),  although excellent, appeared at the beginning of the eighties and reflect  the turbulent history of systematics during the late sixties and most of  the seventies. The rapid maturation of the field during the next decade  rendered these books quickly out of date regarding methods of analysis (the  conceptual framework is still as fresh as ever). Other edited textbooks in  English appeared at the beginning of the nineties, but their lack of  condensation and consistency and their often lack of critical evaluation  made them even dangerous for students trying to learn the subject. R. T.  Schuh book comes to the rescue of students trying to become good  systematists. The book summarizes and condenses the various topics of  Cladistics without loosing important details. It also stresses the place of  phylogenetic studies inside general biological taxonomic practices,  debunking the myth that you must either construct phylogenies or work on  taxonomy and nomenclature. Every student of biology must read this book."
"10.1086/656863","Biological Systematics: Principles and Applications","0801447992","It is an awesome book which contains very good information about phylogeny and systematics in general. Who likes systematics cannot fail to have this book."
"10.1086/656863","Biological Systematics: Principles and Applications","0801447992","Systematics is the art, the science, and the ongoing debate of assigning organisms to phylogenetic groups. If you're from bioinformatics, you may think, \"Oh. Tree-building.\" This book is much more fundmental: it talks about the biological data and philosophical approach needed for any kind of organization. This book informs the beliefs behind your choice of algorithms and data to involve.		Modern bioinformaticists usually assume that tree-building moves forward from DNA or protein strings. That blinds us to the 200 years of classification based on physical features, behavior, and even geographic distribution. In that time, huge numbers of debates have sprung up, too many to list here. A few caught my interest though. First, suppose that \"all pterogyte insects have wings\". The fight starts when an apparent pterogyte shows up with no wings. Personally, I don't see the problem. If having wings is a defining feature, then it's a non-pterogyte, mutations excepted. If having wings is a pattern we noticed but not part of the definition, then the pattern needs work. I'm not a taxonomist, though.		Another debate (p.53) is whether to accept parsimony, the principle of least mechanism, as a taxonomic tool. The objectors claim that it's suspect because of the assumptions behind it, whether or not anyone has \"... stat[ed] precisely what the assumptions are.\" Well, someone may come up with an assumption some day, so we may as well get our objections in early.		This book is distinctly non-mathematical. I don't know all that much, but I do know to ask what background probability model is used to decide whether a similarity or difference matters. That was never mentioned explicitly, but was silently buried in half-page descriptions of jack-knifing and boot-strapping.		It's non-mathematical content is very valuable, though. Its glossary gives clear descriptions of subtly different terms. The chapter on nomenclature, the formal process of naming, was a real discovery for me. I had no idea that the rules were so elaborate.		Perhaps it's the nature of the field, but I was surprised at how few recent references appeared at the end of most chapters. I appreciate the classic papers, back to the 1900s. The 1970s were well represented. References from the 1990s, however, were startling when they did appear, since there were so very few of them. Considering the book's 2000 copyright date, the source material seemed older than I would have expected.		This won't give you any insight into algorithms or mathematical techniques, which disappointed me initially. Once I settled into the biological and historical insight that the book does give, though, I found it very enjoyable."
"10.1086/656863","Biological Systematics: Principles and Applications","0801447992","An extremely informative introduction to systematics.  Breaks down foundational information/concepts in a way that makes them easy to understand and apply."
"10.1086/656863","Biological Systematics: Principles and Applications","0801447992","This book makes a great revision on the development of some of the ideas and methods currently used in cladistics.  Even though it is not a deep revision it succintly addresses the major ideas in which the theory has been developed.  The strongest point that this book makes is the role of philosophy of science in development of cladistic methods (Chapter 3). Schuh scores again in Chapter 6, by presenting the common methods in quantitative cladistics, and by presenting a thoroughly discussion about long branch attraction (a potential nightmare for molecular biologists). It is a little bit too synthetic in presenting the applications of cladistic analyses. It also is biased to applications in biogeography and it presents Brooks Parsimony Analysis (BPA) and Assumptions 0, 1, and 2 as separate things when the aforemention assumptions must be used as part of BPA.	In short it is a great summary of the development of concepts and methods in cladistics during the last 40 years, for such a reason it is a great tool for undergraduate students that my overcome that gap in their knowledge."
"10.1086/656863","Biological Systematics: Principles and Applications","0801447992","Not necessarily just the authors point on the subject of systematics. Schuh provides an objective look at the classification of a taxon and the fundemental basis for understanding such endevors. Although the disagreements of other scientists in the subject area becomes overwhelming, Schuh provides a well written technical look at what is involved in systematics. Surely not intended for a novice in the subject area of biology."
"10.1086/656863","Biological Systematics: Principles and Applications","0801447992","Thanks to quick sending, I could use that book in my class!!"
"10.1086/656863","Biological Systematics: Principles and Applications","0801447992","I added the \"?\" as this is very much an account of the narrow cladistic-phylogenetic approach to a vast subject, so the title could be misleading. Not a book for a biologist wanting to understand systematics, but rather a text for a graduate student working with such approaches."
"10.1086/655035","Bioinformatics","0470089857","I have used databases before (mostly NCBI, TIGR and SWISS PROT) and yet, this book (presumably for dummies) has shown me so much more(which say a lot about me)! It is accurate and gives good step by step guide to how to perform many tasks - from how to find a gene to using the analysis tools and to exploring some of the newer features of these databases - and the areas like you have never looked into before.	It is a well-researched book and the authors are clearly knowledgeable in this area.<p>Even though I have been for a 4-day bioinformatics course (6 months ago), which I thought was pretty good, this book still had so much to offer. Using this book, I was easily able to substitute the proteins of my interest into their examples and generated meaningful hits.<p>The book also covers deeper and more advanced features of BLAST, discusses sequence alignments using several types of algorithm and even has a section on 3D structures. Towards the end of book - it features a section on working with mRNA and building phylogenetics trees - which again are excellent resources for teachers involved in teaching beginners molecular biology.<p>I am a teacher teaching at a Pre-unversity level. The way the book is structured also lends its material to be modified into lesson materials for training students. <p>It is really a great book! Worth every dollar I spent on it!"
"10.1086/655035","Bioinformatics","0470089857","\"Bioinformatics for Dummies\" is an excellent resource.  It is clear, easy to read, well organized and illustrated.  I was particularly pleased by the colloquial tone of the writing: in addition to being informative, it was fun to read!<p>As a scientist who spends at least half of my time BLASTing, I also read it for accuracy and found it to almost error-free (any errors were in the figures).  Additionally, most of the web pages were up-to-date, although as time passes the links will decay and web pages will change their look.  In addition, the book contained enough in-depth content to teach me several new tricks of the trade.  <p>Further, I believe the book had sufficient background material to educate the novice.  To test this, I gave the manual to a material science chemist and he was able to understand the material, at least until he decided it was more than he wanted to know and quit reading.<p>This is a useful text for those who want to know more than an operational definition of bioinformatics and a must for the library of all bioinformatics users."
"10.1086/655035","Bioinformatics","0470089857","I hold a masters degree in computer sciences (so in fact I am a biology dummy), but always had a strong interest for sciences. So I want to delve deeply into this fascinating area, but first wanted to read a book to quickly introduce me the basic concepts. With this background, I must say the book is a little bit disappointing. You can clearly see that this book is written with the biologist in mind, definitely not the computer scientist.		The biological concepts are not explained very well for a biology dummy, let me explain you why  :		1. Some basic biological concepts are not explained. I wanted to have some more explanation on the basic concepts of how molecular and cell biology works. A lot of times, the autors tell you how to use some tool, but is not always clearly explained to me why, for what purpose they use the tool. For instance they explain how to find a list of related protein sequences, but for me it is not clear why biologists need to have such a list. And this is only one example, I could give much more simular examples...		2. Remember guys, I am a dummy, so please explain me the difference between a gene and a genome before using these terms. And also, I heard about chromosomes, but why do you not explain what is it exactly ?. Also, there are a lot of explanations on how to work with RNA, but please explain me more about the functional difference between RNA and DNA.		3. The explanations on how to use serveral internet tools are too wordy, they spent several pages explaining things that are so intuitively clear like \"click this or that button\", \"use menu file, edit, copy to past your stuff to the computer clipboard\"....		4. A lot of complex terms are or not explained the first time they use it (\"phylogenic\"). Sometimes these terms are explained further in the book,  but from a didactical standpoint, you should at least give an informal definition when you first use some concepts...		Conclusion:  I currently read the first hundred pages of the book and maybe I will change this review later on. But I can already tell : the first chapters might be well suited for a computer dummy, but definitely not for a biology dummy. However with some help of the internet(for instance there is an excellent explanation on how cells work at the howstuffworks website http://science.howstuffworks.com/cell.htm), I will continue to read the book further. Maybe after that I will need to change my preview..."
"10.1086/655035","Bioinformatics","0470089857","I am a couple years into a PhD in bioinformatics, but this is the book I started with.  I knew some biology and some computer science, but I still found a lot of the databases, etc. confusing and the field has a decided lack of simplified documentation (though it is getting better).		Of course, bioinformatics is a pretty broad topic and no book could possibly cover everything.		If you do not know any biology at all you probably should also get a basic text on genetics/molecular biology (or read thema at the NCBI web site books section for free).  You don't need anything in depth to read the dummies book, just at the level of an introductory biology book.  Hint: DNA to RNA, RNA to Protein.  And  you want to know why proteins are similar because proteins with similar amino acid sequences often have similar chemical properties and therefore similar functions, so if you know what one protein does you can guess what a protein like it probably does.	:-)		And despite the name of the book the authors are REAL bioinformaticists (T-Coffee rocks!)"
"10.1086/655035","Bioinformatics","0470089857","This is an excellent introduction to Bioinformatics. It does assume some very basic knowledge of biology- perhaps a couple of paragraphs could help the total newbies.		Have you noticed that reviews of bioinformatics books tend to follow certain patterns? The Computer Scientists and mathematicians complain that there is not enough detail about the algorithms, the biologists complain that they could not get through the math, and everyone complains that there is not enough detail about their favorite programs! Let us face the fact that this is a very broad field, and most people that want to learn about it will never design algorithms."
"10.1086/655035","Bioinformatics","0470089857","This book kind of blew me away. Bioinformatics is such a big word.		Then in the second chapter they tell you 'How Most People Use Bioinformatics.' And all of a sudden they have you on line to the National Library of Medicine at the National Institute of Health. They have you looking at protein sequences, and you even understand what they are saying.		This is a 'For Dummies' book. It is written in their traditional style, assuming that you know very little -- well to be sure they say they are making the assumption that 'You likely have a background in molecular biology. If you don't - or if you need to brush up on your molecular biology - Chapter 1 gives you a brief overview of the basics.'		I found that the first few chapters went down pretty easily. By part IV it had gone further than I wanted to go, and I quit reading.		BUT if I were going to be taking a course in bioinformatics, or even thinking about taking such a course, or just looking at a degree in biology, I'd spend a week or two getting around this book. It's written a hell of a lot better than any text you're likely to get assigned, and at its price it's quite a deal."
"10.1086/655035","Bioinformatics","0470089857","The tile might be misleading.		-First : the word \"for dummies\" is misleading, as already explained in a previous review. The expected level of biology knowledge is not advanced, but definitely not at dummy level.		-Second : the word bioinformatics might also be misleading. Especially for more computer educated people, the word bioinformatics is about algorithms applied to solve biological problems. This book however is not about algorithms, it is just about which tools exists and how to use them. You can find the same information for free on the internet at the particular tools websites.		It is like publishing a book with title \"Car mechanics\" en in the book explaining how to drive a car, instead of how the engine works."
"10.1086/655035","Bioinformatics","0470089857","In spite of the title (I don't know many dummies interested in multiple sequence alignments) this reference is written by experts in the field of bioinformatics and is very accessable for the beginner.  I purchased this book as a beginning graduate student so that I could learn which programs to use to compare amino acid and nucleic acid sequences as well as prepare them for publication and this book was perfect for this end.  This text doesn't delve into the algorithms or much theory (which is learned through practice and other sources), nevertheless, I recommend this for the researcher for a crash course or quick reference.  This book really helped me get my feet wet in this area (and recently publish a nice alignment) and will certainly reduce my workload next semester for my bioinformatics course!"
"10.1086/655035","Bioinformatics","0470089857","There is a lot of the book related to giving you details of particular sites to go to -- to perform various tasks.  And there is details on exactly the screens you will see how you should fill them out.  I found a LOT of that information to be dated and incorrect.		I found the information about the basic Bioinformatics tasks to be relevant and accurate, but many of the details given were not of much use, due to the reason given above."
"10.1086/655035","Bioinformatics","0470089857","Many people are derisive about the \"for Dummies\" series, believing them to be too simplistic and sometimes even an insult to their intelligence. That can hardly apply to this book, as there is nothing \"dummy\" about it. You need a significant background in biology and chemistry in order to understand most of it. You need to understand the amino acid structure of proteins, the structure of DNA and many fundamental principles of data analysis. Some knowledge of the structure and operations of databases is also needed. The authors include a large number of web sites containing additional information and that can run analyses.	 The coverage is so thorough and detailed that this is the only \"for dummies\" book that I have seen that could honestly be recommended as a college text.  And not just at the freshman level either."
"10.1086/655035","Bioinformatics","0470089857","The first chapter is a short review of DNA and RNA sequences, amino acids, and protein. The other chapters teach you to use the free software found on the Internet to work with your research.  Information is also given which helps explain some biochemicals. My skills are in Software Development using C++ language, and I need more information on biochemicals to understand the problems and to develop algorithms to solve them.		My only criticism is that I would like the book to give more biochemical theory before taking up the subject of Internet software.		Overall, this is a good beginner's book on biochemistry."
"10.1086/655035","Bioinformatics","0470089857","I'm glad I bought this book and I will continue to refer to it.  The remit of the Dummies series is to provide a guide to its subject matter without any great fuss.  The text focuses on practical techniques without unnecessary diversion into the detail of molecular biology or computer science.  In this respect it would have been a difficult book to author, readers having come from one discipline or the other.  I agree with previous reviewers that this is well worth reading before doing a bioinformatics course or degree.  Bioinformatics is a new field, and this book has delivered a useful introduction to it without recourse to expensive textbooks full of unreadable filler."
"10.1086/655035","Bioinformatics","0470089857","Good concepts for a beginner ad intermediate level. Concepts are clearly explained and are easy to understand."
"10.1086/655035","Bioinformatics","0470089857","It is a great book for a any college level student,	even with very little background in Biology. They gave	you all the background you need to understand why you	want to do such and such analysis.<p>No painful math either! and some of the jokes are actually	... fun.<p>It is soooo different from other Bioinfo books I came across.<p>A good buy, really."
"10.1086/655035","Bioinformatics","0470089857","I got this book a week ago because one of my profs offered to buy it for a volunteer who was willing to check it out and then make a recommendation on it to the rest of the class. I'm glad I volunteered, and I'm encouraging my classmates to get their hands on a copy. This book wasn't boring. It was completely hands on, and it addressed the topic from the perspective of a biologist, not a technophile-- which was exactly what I needed. It helped me reconcile my love for pure science with my increasing anxiety about needing to be so darn computer proficient to have any kind of job I can apply my degree to these days. I'm glad I got a hold of it early in the semester. I think it's going to really impact my grade in the class-- Oh, and my understanding of bioinformatics!"
"10.1086/655035","Bioinformatics","0470089857","The second edition is now over six years old. There have been huge changes in that time and while the basics are still mostly correct just about every web site has changed substantially in the last six years.  The idea of Bioinformatics for Dummies is needed now more than ever but it really needs to be current to be worth buying."
"10.1086/655035","Bioinformatics","0470089857","As a Phd student in biology, this book offers great reference for bioinformatics in a clear and smooth manner. it explains briefly the concept behind few notions and then shows you how to search, interpret the data you receive. no previous knowledge of bioinformatics is necessary to have this book. the only problem is that several websites either change/close their website or change the application format and it becomes hard to follow the book instructions. however it is a very important tool for researchers."
"10.1086/655035","Bioinformatics","0470089857","I really cannot imagine a good audience for this title.	If a person has any interest in bioinformatics, they are certainly too intelligent to benefit from this book's obsession with explanations that could only be appropriate for readers that are over 90 or under 9."
"10.1086/655035","Bioinformatics","0470089857","Book should be treated as a secondary source of knowledge that will help to refresh memory about bioinformatics. Easy written, nice for weekend."
"10.1086/655035","Bioinformatics","0470089857","I am a molecular biologist who is familiar with many parts covered in the book but wanted a more conprehensive, easy to understand, overview of bioinformatics.  I loved reading this book and have asked my research student to read it as well."
"10.1086/655035","Bioinformatics","0470089857","I'm SO pleased with this book. I've done some bioinformatics (classes and workshops), but this book really helped me get a grasp on the things I was missing. There's a lot of info and tutorial styles writing in it. They use a few examples all throughout the book and you can easily follow along or use your own information. I'm a mid level user who wants to do more, and this has given me lots of ideas I didn't know were out there. This field moves so fast, that it's nice to get a quick start. I highly recommend this book."
"10.1086/655035","Bioinformatics","0470089857","Very simple and very well explained, I recommend this book to all who show interest in using bioinformatics as a research tool."
"10.1086/655035","Bioinformatics","0470089857","This is overall a good book on bioinformatics. If you like the Dummy series, you will like this book. It's more thorough on the biology side of bioinformatics than on the \"information\" side. However, the concepts are explained in an easy to understand fashion. Worth the price."
"10.1086/655035","Bioinformatics","0470089857","This book will get you up and running on Bioinformatics in no time.  I wish I got this book before I enrolled in a $$$$$ Bioinformatics course.  I got more knowledge and information from this book $$$$$ than the course!  And I am just in chapter 5 of the book and I'm more than half way through that $$$$$ course."
"10.1086/650226","Introduction to Paleobiology and the Fossil Record",1405141573,"Very expensive book not to use color. Although fossils are discussed adequately, it does not do the job for a student who needs to learn the distinguishing characteristics of some 200 fossils in a semester. Almost overwhelming in scope, but it needs to be for a demanding class."
"10.1086/650226","Introduction to Paleobiology and the Fossil Record",1405141573,"I'm taking Paleobiostrat with a pretty well known and respected professor, and he loves the older edition of this book, absolutely hates the writing format of this new edition."
"10.1086/650226","Introduction to Paleobiology and the Fossil Record",1405141573,"I thought this book was one of the best Dinosuar books I have ever read.......this book had lots of really neat info about the different kinds of dinosuars and how to be a paleontologist in your own time. I give this  excellent dino book four stars!!!!"
"10.1086/650226","Introduction to Paleobiology and the Fossil Record",1405141573,"Ordered this textbook new, and it arrived with tears on the outside of the binding and edges of book is scratched and dented, to the point where the edges of the cover paper is splitting into two pages.  I am very disappointed and have received used books in better quality."
"10.1086/650226","Introduction to Paleobiology and the Fossil Record",1405141573,"Great, fantastic book for general knowlege of fossilation and geology back ground. highly reccomend"
"10.1086/650226","Introduction to Paleobiology and the Fossil Record",1405141573,"This book came in a great condition! It was almost like new! And it also came fast! It was a great price for a book in such a great condition."
